{
  "schema_id": "ecai/convergence_result/1.0",
  "run_id": "11111111-1111-4111-8111-111111111111",
  "produced_at": "2026-09-15T22:14:00Z",
  "provenance": {
    "stage": "CONVERGENCE",
    "persona": null,
    "model_id": null,
    "input_artifact_hashes": [
      "ffffffffffffffffffffffffffffffffffffffffffffffffffffffffffffffff"
    ]
  },
  "game_key": "Away@Home 2026-09-15",
  "market_scope": "moneyline",
  "tally": {
    "supports": { "HOME": 2 },
    "opposes": { "AWAY": 1 },
    "no_data": 0,
    "invalid": 0
  },
  "valid_analysts": 3,
  "quorum_met": true,
  "agreement_index": 0.6666666666666666,
  "direction": "HOME",
  "dissent_map": [
    {
      "persona": "contrarian",
      "verdict": "OPPOSES",
      "selection": "AWAY",
      "reason_codes": ["LINE_VALUE_FAVORS_AWAY"]
    }
  ],
  "sufficiency": "SUFFICIENT",
  "status": "CONVERGED",
  "det_output_ref": "eeeeeeeeeeeeeeeeeeeeeeeeeeeeeeeeeeeeeeeeeeeeeeeeeeeeeeeeeeeeeeee",
  "analyst_verdict_refs": [
    "1111111111111111111111111111111111111111111111111111111111111111",
    "2222222222222222222222222222222222222222222222222222222222222222",
    "3333333333333333333333333333333333333333333333333333333333333333"
  ]
}
